<!ELEMENT listaventas (venta*)>
    <!ELEMENT venta (importe,comprador,vendedor,fecha?)>
    <!ELEMENT importe (#PCDATA)>
    <!ELEMENT comprador (#PCDATA)>
    <!ELEMENT vendedor (#PCDATA)>
    <!ELEMENT fecha (#PCDATA)>
    <!ATTLIST venta codFactura ID #REQUIRED>